Title,Category,Project Link,Proposer,Student Availability,CM COMP30030 Difficulty,CS COMP30040 Difficulty,PhD potential
A Blockchain Based Application,Student Own,http://studentnet.cs.manchester.ac.uk/ugt/year3/project/projectbookdetails.php?projectid=55080,Richard Banach,1 student,F,F,No
A Quantum Computing Project,Student Own,http://studentnet.cs.manchester.ac.uk/ugt/year3/project/projectbookdetails.php?projectid=55079,Richard Banach,1 student,H,H,Yes
Propose your own project in Logic/Automated Reasoning/Verification/Maths,Student Own,http://studentnet.cs.manchester.ac.uk/ugt/year3/project/projectbookdetails.php?projectid=55251,Konstantin Korovin,1 student,F,F,Yes
Your idea for a mathematical project,Student Own,http://studentnet.cs.manchester.ac.uk/ugt/year3/project/projectbookdetails.php?projectid=55177,Andrea Schalk,2 students,C,C,No
A Botnet Detector,General Applications,http://studentnet.cs.manchester.ac.uk/ugt/year3/project/projectbookdetails.php?projectid=55119,Ning Zhang,2 students,F,F,No
A Game of Spacetime,General Applications,http://studentnet.cs.manchester.ac.uk/ugt/year3/project/projectbookdetails.php?projectid=55285,Bijan Parsia,4 students,F,F,No
A hi-tech pantry,General Applications,http://studentnet.cs.manchester.ac.uk/ugt/year3/project/projectbookdetails.php?projectid=55148,Gavin Brown,1 student,F,F,No
A Multi-factor Authentication Simulator,General Applications,http://studentnet.cs.manchester.ac.uk/ugt/year3/project/projectbookdetails.php?projectid=55118,Ning Zhang,2 students,F,F,No
A Music Theory Tutor using Visualisation,General Applications,http://studentnet.cs.manchester.ac.uk/ugt/year3/project/projectbookdetails.php?projectid=55056,Mary Mcgee Wood,3 students,F,F,No
A Recipe for Perfect Recipes?,General Applications,http://studentnet.cs.manchester.ac.uk/ugt/year3/project/projectbookdetails.php?projectid=55130,Kung-kiu Lau,2 students,F,F,No
A Simulator for Teaching Ciphers,General Applications,http://studentnet.cs.manchester.ac.uk/ugt/year3/project/projectbookdetails.php?projectid=55117,Ning Zhang,3 students,F,F,No
A Software Tool to Illustrate Graph Colouring,General Applications,http://studentnet.cs.manchester.ac.uk/ugt/year3/project/projectbookdetails.php?projectid=55367,Rizos Sakellariou,2 students,F,F,Yes
A Virtual Turntable,General Applications,http://studentnet.cs.manchester.ac.uk/ugt/year3/project/projectbookdetails.php?projectid=55259,Sean Bechhofer,3 students,F,F,No
Agent Based Epidemiological Modelling of COVID-19,General Applications,http://studentnet.cs.manchester.ac.uk/ugt/year3/project/projectbookdetails.php?projectid=55286,Bijan Parsia,8 students,F,F,Yes
Analysing the Landscape of UK Computer Science research,General Applications,http://studentnet.cs.manchester.ac.uk/ugt/year3/project/projectbookdetails.php?projectid=55149,Gavin Brown,2 students,F,F,No
Analysing the System Call Invocation Behaviour of Applications,General Applications,http://studentnet.cs.manchester.ac.uk/ugt/year3/project/projectbookdetails.php?projectid=55066,Pierre Olivier,1 student,H,H,Yes
Auction Mechanisms for Local Energy Markets,General Applications,http://studentnet.cs.manchester.ac.uk/ugt/year3/project/projectbookdetails.php?projectid=55318,Mustafa Mustafa,1 student,F,F,No
Automatic Audio Processing for Podcasts and Videos,General Applications,http://studentnet.cs.manchester.ac.uk/ugt/year3/project/projectbookdetails.php?projectid=55309,Terry Morley,2 students,F,F,Yes
Cellular Automata for Simulations of Dynamic Systems,General Applications,http://studentnet.cs.manchester.ac.uk/ugt/year3/project/projectbookdetails.php?projectid=55185,Uli Sattler,2 students,F,F,No
Cheapest Public Transport to Work,General Applications,http://studentnet.cs.manchester.ac.uk/ugt/year3/project/projectbookdetails.php?projectid=55172,Thomas Carroll,2 students,F,F,No
Client-Server Backgammon variant player,General Applications,http://studentnet.cs.manchester.ac.uk/ugt/year3/project/projectbookdetails.php?projectid=55368,Rizos Sakellariou,4 students,F,F,No
Coding Their Future: Computer Science Education in secondary schools,General Applications,http://studentnet.cs.manchester.ac.uk/ugt/year3/project/projectbookdetails.php?projectid=55300,Duncan Hull,8 students,H,H,No
Describing Folk Dance,General Applications,http://studentnet.cs.manchester.ac.uk/ugt/year3/project/projectbookdetails.php?projectid=55257,Sean Bechhofer,3 students,F,F,No
Design Space Exploration of Per-Application Tailored Kernels,General Applications,http://studentnet.cs.manchester.ac.uk/ugt/year3/project/projectbookdetails.php?projectid=55065,Pierre Olivier,1 student,H,H,Yes
Develop a Context-Aware Access Control (CAAC) Decision Engine,General Applications,http://studentnet.cs.manchester.ac.uk/ugt/year3/project/projectbookdetails.php?projectid=55113,Ning Zhang,2 students,C,C,No
Development of an Application for Data Consumers in Digital Data Marketplaces,General Applications,http://studentnet.cs.manchester.ac.uk/ugt/year3/project/projectbookdetails.php?projectid=55417,Sandra Sampaio,1 student,C,C,Yes
Engaging History Tools,General Applications,http://studentnet.cs.manchester.ac.uk/ugt/year3/project/projectbookdetails.php?projectid=55287,Bijan Parsia,6 students,F,F,No
Enigma Machine Simulator,General Applications,http://studentnet.cs.manchester.ac.uk/ugt/year3/project/projectbookdetails.php?projectid=55173,Thomas Carroll,2 students,F,F,No
Evaluating task graph scheduling algorithms,General Applications,http://studentnet.cs.manchester.ac.uk/ugt/year3/project/projectbookdetails.php?projectid=55369,Rizos Sakellariou,2 students,C,C,Yes
Evaluating the accuracy of Movebase in a Nuclear Remote Inspection Scenario,General Applications,http://studentnet.cs.manchester.ac.uk/ugt/year3/project/projectbookdetails.php?projectid=55107,Louise Dennis,1 student,F,F,No
Everything Happens Somewhere,General Applications,http://studentnet.cs.manchester.ac.uk/ugt/year3/project/projectbookdetails.php?projectid=55050,Mary Mcgee Wood,3 students,F,F,Yes
Exercise Monitor,General Applications,http://studentnet.cs.manchester.ac.uk/ugt/year3/project/projectbookdetails.php?projectid=55102,Tim Morris,1 student,F,F,No
Game of Dots and Boxes (aka: Squares),General Applications,http://studentnet.cs.manchester.ac.uk/ugt/year3/project/projectbookdetails.php?projectid=55174,Thomas Carroll,2 students,F,F,No
Good ol' linux ical for Windows,General Applications,http://studentnet.cs.manchester.ac.uk/ugt/year3/project/projectbookdetails.php?projectid=55164,Richard Banach,1 student,F,F,No
How many students will apply for this project?,General Applications,http://studentnet.cs.manchester.ac.uk/ugt/year3/project/projectbookdetails.php?projectid=55110,Gavin Brown,1 student,C,C,No
How reliable are hard disk (HDD) and solid state (SSD) drives?,General Applications,http://studentnet.cs.manchester.ac.uk/ugt/year3/project/projectbookdetails.php?projectid=55073,Tom Thomson,1 student,C,C,No
Interval Deep Evidential Classification for Medical and Inverse Problems,General Applications,http://studentnet.cs.manchester.ac.uk/ugt/year3/project/projectbookdetails.php?projectid=55371,Caprio Michele,2 students,F,F,Yes
Local Energy Markets with Grid Constraints,General Applications,http://studentnet.cs.manchester.ac.uk/ugt/year3/project/projectbookdetails.php?projectid=55321,Mustafa Mustafa,1 student,F,F,Yes
Local Energy Markets with User Preferences,General Applications,http://studentnet.cs.manchester.ac.uk/ugt/year3/project/projectbookdetails.php?projectid=55317,Mustafa Mustafa,1 student,F,F,No
Localisation App to Visualise Blood Glucose Levels for Type 1 Diabetics,General Applications,http://studentnet.cs.manchester.ac.uk/ugt/year3/project/projectbookdetails.php?projectid=55195,Paul Nutter,1 student,F,F,No
Logic and automated reasoning,General Applications,http://studentnet.cs.manchester.ac.uk/ugt/year3/project/projectbookdetails.php?projectid=55183,Uli Sattler,4 students,F,F,Yes
Make programs small again,General Applications,http://studentnet.cs.manchester.ac.uk/ugt/year3/project/projectbookdetails.php?projectid=55191,Pavlos Petoumenos,1 student,H,C,Yes
Managing Crowdsourced Points of Interest Information,General Applications,http://studentnet.cs.manchester.ac.uk/ugt/year3/project/projectbookdetails.php?projectid=55064,Mary Mcgee Wood,3 students,F,F,No
Modelling Polarization in Social Networks,General Applications,http://studentnet.cs.manchester.ac.uk/ugt/year3/project/projectbookdetails.php?projectid=55125,Louise Dennis,2 students,F,F,Yes
Modular Patch Storage/Library,General Applications,http://studentnet.cs.manchester.ac.uk/ugt/year3/project/projectbookdetails.php?projectid=55261,Sean Bechhofer,1 student,F,F,No
Modular Synthesis with VCV Rack,General Applications,http://studentnet.cs.manchester.ac.uk/ugt/year3/project/projectbookdetails.php?projectid=55260,Sean Bechhofer,3 students,C,C,No
My Little Operating System,General Applications,http://studentnet.cs.manchester.ac.uk/ugt/year3/project/projectbookdetails.php?projectid=55266,Jim Garside,3 students,C,F,No
My Mortgage Modeller,General Applications,http://studentnet.cs.manchester.ac.uk/ugt/year3/project/projectbookdetails.php?projectid=55026,Gavin Brown,1 student,F,F,No
N-Version Testing,General Applications,http://studentnet.cs.manchester.ac.uk/ugt/year3/project/projectbookdetails.php?projectid=55289,Bijan Parsia,4 students,F,F,No
Non-standard automated reasoning,General Applications,http://studentnet.cs.manchester.ac.uk/ugt/year3/project/projectbookdetails.php?projectid=55184,Uli Sattler,4 students,F,F,Yes
Panorama Creation,General Applications,http://studentnet.cs.manchester.ac.uk/ugt/year3/project/projectbookdetails.php?projectid=55258,Sean Bechhofer,3 students,F,F,No
Performance Estimation Across Instruction Set Architectures,General Applications,http://studentnet.cs.manchester.ac.uk/ugt/year3/project/projectbookdetails.php?projectid=55067,Pierre Olivier,1 student,H,H,No
Predicting a program's cache behaviour,General Applications,http://studentnet.cs.manchester.ac.uk/ugt/year3/project/projectbookdetails.php?projectid=55190,Pavlos Petoumenos,1 student,F,F,Yes
Privacy-cost trade-off in electricity load shifting (with LLMs),General Applications,http://studentnet.cs.manchester.ac.uk/ugt/year3/project/projectbookdetails.php?projectid=55319,Mustafa Mustafa,2 students,F,F,Yes
Revolutionising Academic Scheduling with Advanced Timetabling Solutions,General Applications,http://studentnet.cs.manchester.ac.uk/ugt/year3/project/projectbookdetails.php?projectid=55046,Gareth Henshall,2 students,F,F,No
Room occupancy viewing and booking system,General Applications,http://studentnet.cs.manchester.ac.uk/ugt/year3/project/projectbookdetails.php?projectid=55210,Paul Nutter,1 student,F,F,No
"Simple assistive software: design, development, and evaluation",General Applications,http://studentnet.cs.manchester.ac.uk/ugt/year3/project/projectbookdetails.php?projectid=55057,Mary Mcgee Wood,3 students,C,M,Yes
Simulating string playing to make physical modelling synthesis more realistic,General Applications,http://studentnet.cs.manchester.ac.uk/ugt/year3/project/projectbookdetails.php?projectid=55232,Joseph Razavi,1 student,F,F,No
Social Network Analysis and Metrics,General Applications,http://studentnet.cs.manchester.ac.uk/ugt/year3/project/projectbookdetails.php?projectid=55370,Rizos Sakellariou,2 students,C,C,Yes
Software Analysis and Large Language Models,General Applications,http://studentnet.cs.manchester.ac.uk/ugt/year3/project/projectbookdetails.php?projectid=55315,Youcheng Sun,1 student,F,H,Yes
Statically predict the runtime behaviour of parts of a program,General Applications,http://studentnet.cs.manchester.ac.uk/ugt/year3/project/projectbookdetails.php?projectid=55189,Pavlos Petoumenos,2 students,H,H,Yes
Strategic Scheduling Solutions: Elevating the Six Nations Rugby Experience,General Applications,http://studentnet.cs.manchester.ac.uk/ugt/year3/project/projectbookdetails.php?projectid=55043,Gareth Henshall,2 students,F,F,No
Synaesthetic Computing,General Applications,http://studentnet.cs.manchester.ac.uk/ugt/year3/project/projectbookdetails.php?projectid=55128,Kung-kiu Lau,3 students,F,F,No
Teaching Software Engineering,General Applications,http://studentnet.cs.manchester.ac.uk/ugt/year3/project/projectbookdetails.php?projectid=55290,Bijan Parsia,8 students,F,F,No
Type 1 Diabetes Food Management System,General Applications,http://studentnet.cs.manchester.ac.uk/ugt/year3/project/projectbookdetails.php?projectid=55198,Paul Nutter,1 student,F,F,No
Validating semantic artefact profiles for Research Object Crates,General Applications,http://studentnet.cs.manchester.ac.uk/ugt/year3/project/projectbookdetails.php?projectid=55352,Stian Soiland-reyes,2 students,F,F,Yes
Verification of Deep Neural Networks,General Applications,http://studentnet.cs.manchester.ac.uk/ugt/year3/project/projectbookdetails.php?projectid=55053,Lucas Cordeiro,2 students,F,F,No
Verifying Python Programs in Robotic Applications,General Applications,http://studentnet.cs.manchester.ac.uk/ugt/year3/project/projectbookdetails.php?projectid=55055,Lucas Cordeiro,2 students,F,F,No
Visualising Infinity,General Applications,http://studentnet.cs.manchester.ac.uk/ugt/year3/project/projectbookdetails.php?projectid=55129,Kung-kiu Lau,2 students,F,F,No
Will it merge?,General Applications,http://studentnet.cs.manchester.ac.uk/ugt/year3/project/projectbookdetails.php?projectid=55188,Pavlos Petoumenos,1 student,C,C,Yes
3D Hand tracking from monocular RGB,Graphical applications and systems,http://studentnet.cs.manchester.ac.uk/ugt/year3/project/projectbookdetails.php?projectid=55421,Aphrodite Galata,3 students,C,C,Yes
Activity Monitor,Graphical applications and systems,http://studentnet.cs.manchester.ac.uk/ugt/year3/project/projectbookdetails.php?projectid=55101,Tim Morris,1 student,F,F,No
Animation of avatars using human motion capture data,Graphical applications and systems,http://studentnet.cs.manchester.ac.uk/ugt/year3/project/projectbookdetails.php?projectid=55424,Aphrodite Galata,2 students,C,C,No
Camera viewpoint,Graphical applications and systems,http://studentnet.cs.manchester.ac.uk/ugt/year3/project/projectbookdetails.php?projectid=55106,Tim Morris,1 student,H,C,No
Chess Tutor,Graphical applications and systems,http://studentnet.cs.manchester.ac.uk/ugt/year3/project/projectbookdetails.php?projectid=55304,Terry Morley,2 students,F,F,Yes
Climbing Animation Simulator,Graphical applications and systems,http://studentnet.cs.manchester.ac.uk/ugt/year3/project/projectbookdetails.php?projectid=55252,David Petrescu,2 students,F,F,No
Computer Vision aids for the confused,Graphical applications and systems,http://studentnet.cs.manchester.ac.uk/ugt/year3/project/projectbookdetails.php?projectid=55105,Tim Morris,1 student,F,F,No
GymBuddy: Computer Vision based Fitness Assistant,Graphical applications and systems,http://studentnet.cs.manchester.ac.uk/ugt/year3/project/projectbookdetails.php?projectid=55425,Aphrodite Galata,2 students,C,C,Yes
Implementing a Graphical User Interface for Network Simulator 3,Graphical applications and systems,http://studentnet.cs.manchester.ac.uk/ugt/year3/project/projectbookdetails.php?projectid=55031,Stewart Blakeway,4 students,H,M,No
Night-time image processing,Graphical applications and systems,http://studentnet.cs.manchester.ac.uk/ugt/year3/project/projectbookdetails.php?projectid=55104,Tim Morris,1 student,H,C,No
Non-realtime rendering of a 3D scene as pixel art,Graphical applications and systems,http://studentnet.cs.manchester.ac.uk/ugt/year3/project/projectbookdetails.php?projectid=55235,Joseph Razavi,1 student,F,F,No
Photo Collage,Graphical applications and systems,http://studentnet.cs.manchester.ac.uk/ugt/year3/project/projectbookdetails.php?projectid=55426,Aphrodite Galata,1 student,C,C,No
Recognising Street Furniture,Graphical applications and systems,http://studentnet.cs.manchester.ac.uk/ugt/year3/project/projectbookdetails.php?projectid=55099,Tim Morris,1 student,F,F,No
Sensitivity to complex geometry simplifications using Nanite.,Graphical applications and systems,http://studentnet.cs.manchester.ac.uk/ugt/year3/project/projectbookdetails.php?projectid=55202,David Petrescu,2 students,C,C,Yes
Super Resolution,Graphical applications and systems,http://studentnet.cs.manchester.ac.uk/ugt/year3/project/projectbookdetails.php?projectid=55103,Tim Morris,1 student,F,F,No
Tracking football players,Graphical applications and systems,http://studentnet.cs.manchester.ac.uk/ugt/year3/project/projectbookdetails.php?projectid=55420,Aphrodite Galata,2 students,C,C,No
Video Synthesis,Graphical applications and systems,http://studentnet.cs.manchester.ac.uk/ugt/year3/project/projectbookdetails.php?projectid=55428,Aphrodite Galata,1 student,C,C,No
Virtual Reality Models,Graphical applications and systems,http://studentnet.cs.manchester.ac.uk/ugt/year3/project/projectbookdetails.php?projectid=55100,Tim Morris,2 students,F,F,No
Virtual tourist,Graphical applications and systems,http://studentnet.cs.manchester.ac.uk/ugt/year3/project/projectbookdetails.php?projectid=55109,Tim Morris,1 student,F,F,No
What can I see?,Graphical applications and systems,http://studentnet.cs.manchester.ac.uk/ugt/year3/project/projectbookdetails.php?projectid=55098,Tim Morris,1 student,C,F,No
Which way is up - extracting information from magnetic images,Graphical applications and systems,http://studentnet.cs.manchester.ac.uk/ugt/year3/project/projectbookdetails.php?projectid=55047,Tom Thomson,2 students,C,H,Yes
A Blockchain-based Application,Communications and security,http://studentnet.cs.manchester.ac.uk/ugt/year3/project/projectbookdetails.php?projectid=55114,Ning Zhang,2 students,C,C,No
A Cross-domain Auditing Service,Communications and security,http://studentnet.cs.manchester.ac.uk/ugt/year3/project/projectbookdetails.php?projectid=55116,Ning Zhang,2 students,C,M,No
A RBAC (Role Based Access Control) Simulator,Communications and security,http://studentnet.cs.manchester.ac.uk/ugt/year3/project/projectbookdetails.php?projectid=55111,Ning Zhang,3 students,F,F,No
Benchmark tests for FAIR Digital Objects,Communications and security,http://studentnet.cs.manchester.ac.uk/ugt/year3/project/projectbookdetails.php?projectid=55353,Stian Soiland-reyes,2 students,F,F,Yes
Blockchain-based Online Poker,Communications and security,http://studentnet.cs.manchester.ac.uk/ugt/year3/project/projectbookdetails.php?projectid=55122,Bernardo Magri,1 student,F,F,Yes
Directions on Cryptography,Communications and security,http://studentnet.cs.manchester.ac.uk/ugt/year3/project/projectbookdetails.php?projectid=55120,Bernardo Magri,2 students,H,H,Yes
Host Based Intrusion Detection in a Cloud Environment,Communications and security,http://studentnet.cs.manchester.ac.uk/ugt/year3/project/projectbookdetails.php?projectid=55115,Ning Zhang,2 students,H,C,No
Investigation of Digital Forensic Techniques,Communications and security,http://studentnet.cs.manchester.ac.uk/ugt/year3/project/projectbookdetails.php?projectid=55112,Ning Zhang,2 students,H,H,No
Linux Kernel Testing with Large Language Models,Communications and security,http://studentnet.cs.manchester.ac.uk/ugt/year3/project/projectbookdetails.php?projectid=55314,Youcheng Sun,1 student,F,F,Yes
"MANETs, VANETs and FANETs",Communications and security,http://studentnet.cs.manchester.ac.uk/ugt/year3/project/projectbookdetails.php?projectid=55035,Stewart Blakeway,4 students,M,M,No
Miner Extractable Value (MEV) opportunities,Communications and security,http://studentnet.cs.manchester.ac.uk/ugt/year3/project/projectbookdetails.php?projectid=55121,Bernardo Magri,1 student,H,H,Yes
Privacy Preserving and Verifiable Billing in Local Energy Markets,Communications and security,http://studentnet.cs.manchester.ac.uk/ugt/year3/project/projectbookdetails.php?projectid=55322,Mustafa Mustafa,2 students,H,H,No
Proof-of-stake Bitcoin,Communications and security,http://studentnet.cs.manchester.ac.uk/ugt/year3/project/projectbookdetails.php?projectid=55123,Bernardo Magri,1 student,H,H,Yes
Routing Protocol Performance in Mobile Ad hoc Networks,Communications and security,http://studentnet.cs.manchester.ac.uk/ugt/year3/project/projectbookdetails.php?projectid=55039,Stewart Blakeway,5 students,M,M,No
Software Compartmentalisation,Communications and security,http://studentnet.cs.manchester.ac.uk/ugt/year3/project/projectbookdetails.php?projectid=55069,Pierre Olivier,1 student,H,H,Yes
Verification and Testing of Deep Learning Systems,Communications and security,http://studentnet.cs.manchester.ac.uk/ugt/year3/project/projectbookdetails.php?projectid=55312,Youcheng Sun,1 student,F,F,Yes
Verifying Information Flow Security for Blockchain-based Smart Contracts,Communications and security,http://studentnet.cs.manchester.ac.uk/ugt/year3/project/projectbookdetails.php?projectid=55059,Lucas Cordeiro,2 students,M,M,No
Web3 Application,Communications and security,http://studentnet.cs.manchester.ac.uk/ugt/year3/project/projectbookdetails.php?projectid=55229,Bernardo Magri,4 students,F,F,Yes
A Deep Dive into Bregman Divergences,Artificial Intelligence,http://studentnet.cs.manchester.ac.uk/ugt/year3/project/projectbookdetails.php?projectid=55327,Gavin Brown,1 student,F,F,Yes
A Machine Learning approach to Crude Oil Price Prediction,Artificial Intelligence,http://studentnet.cs.manchester.ac.uk/ugt/year3/project/projectbookdetails.php?projectid=55144,Xiao-jun Zeng,1 student,F,F,No
A machine learning approach to forecasting of currency exchange rates,Artificial Intelligence,http://studentnet.cs.manchester.ac.uk/ugt/year3/project/projectbookdetails.php?projectid=55145,Xiao-jun Zeng,1 student,F,F,No
A robot-composer,Artificial Intelligence,http://studentnet.cs.manchester.ac.uk/ugt/year3/project/projectbookdetails.php?projectid=55385,Ainur Begalinova,1 student,F,F,Yes
Advancing Robotic Hand Manipulation for Diverse Object Interaction,Artificial Intelligence,http://studentnet.cs.manchester.ac.uk/ugt/year3/project/projectbookdetails.php?projectid=55375,Ainur Begalinova,2 students,F,F,Yes
AI Image Generation,Artificial Intelligence,http://studentnet.cs.manchester.ac.uk/ugt/year3/project/projectbookdetails.php?projectid=55344,Tingting Mu,3 students,H,H,No
An Investigation of Voting as a means to Resolve Moral Uncertainty,Artificial Intelligence,http://studentnet.cs.manchester.ac.uk/ugt/year3/project/projectbookdetails.php?projectid=55084,Louise Dennis,1 student,C,C,No
Applying Text Analytics and Machine Learning to Study AI/ML Research Trends,Artificial Intelligence,http://studentnet.cs.manchester.ac.uk/ugt/year3/project/projectbookdetails.php?projectid=55345,Tingting Mu,1 student,H,H,No
Audio Classification via Deep Learning,Artificial Intelligence,http://studentnet.cs.manchester.ac.uk/ugt/year3/project/projectbookdetails.php?projectid=55025,Ke Chen,3 students,N,H,Yes
Benchmarking Machine Ethics,Artificial Intelligence,http://studentnet.cs.manchester.ac.uk/ugt/year3/project/projectbookdetails.php?projectid=55085,Louise Dennis,1 student,H,C,No
Can ChatGPT help requirement engineers to classify user requirements?,Artificial Intelligence,http://studentnet.cs.manchester.ac.uk/ugt/year3/project/projectbookdetails.php?projectid=55217,Liping Zhao,3 students,H,C,Yes
Can ChatGPT help users to compose user stores for their software requirements?,Artificial Intelligence,http://studentnet.cs.manchester.ac.uk/ugt/year3/project/projectbookdetails.php?projectid=55222,Liping Zhao,3 students,C,M,Yes
Car Co-driver Mobile Phone App,Artificial Intelligence,http://studentnet.cs.manchester.ac.uk/ugt/year3/project/projectbookdetails.php?projectid=55293,Terry Morley,2 students,F,F,No
Chaotic Systems and Neural Nets,Artificial Intelligence,http://studentnet.cs.manchester.ac.uk/ugt/year3/project/projectbookdetails.php?projectid=55299,Anirbit Mukherjee,2 students,C,C,Yes
Character Recognition using Mathematical Morphology,Artificial Intelligence,http://studentnet.cs.manchester.ac.uk/ugt/year3/project/projectbookdetails.php?projectid=55168,Francisco Lobo,2 students,F,F,No
Classification of app reviews for requirements engineering using deep learning models,Artificial Intelligence,http://studentnet.cs.manchester.ac.uk/ugt/year3/project/projectbookdetails.php?projectid=55227,Liping Zhao,3 students,C,M,Yes
Cognitive Robotics and AI,Artificial Intelligence,http://studentnet.cs.manchester.ac.uk/ugt/year3/project/projectbookdetails.php?projectid=55042,Angelo Cangelosi,2 students,C,C,Yes
"Computational Fluid Dynamics, OpenFoam and Neural Operators",Artificial Intelligence,http://studentnet.cs.manchester.ac.uk/ugt/year3/project/projectbookdetails.php?projectid=55301,Anirbit Mukherjee,2 students,M,M,Yes
Computing the size of game trees,Artificial Intelligence,http://studentnet.cs.manchester.ac.uk/ugt/year3/project/projectbookdetails.php?projectid=55306,Jon Shapiro,2 students,M,F,No
Constructing Explanations for Description Logic Reasoning,Artificial Intelligence,http://studentnet.cs.manchester.ac.uk/ugt/year3/project/projectbookdetails.php?projectid=55208,Francisco Lobo,2 students,F,F,No
Dashboard for symbolic machine learning prover SMLP,Artificial Intelligence,http://studentnet.cs.manchester.ac.uk/ugt/year3/project/projectbookdetails.php?projectid=55248,Konstantin Korovin,1 student,F,F,Yes
Enhancing human-robot interaction,Artificial Intelligence,http://studentnet.cs.manchester.ac.uk/ugt/year3/project/projectbookdetails.php?projectid=55379,Ainur Begalinova,2 students,F,F,Yes
Evidential-Bayes Theory for Continual Learning,Artificial Intelligence,http://studentnet.cs.manchester.ac.uk/ugt/year3/project/projectbookdetails.php?projectid=55351,Caprio Michele,2 students,F,F,Yes
