Title,Category,Project Link,Proposer,Student Availability,CM COMP30030 Difficulty,CS COMP30040 Difficulty,PhD potential
Walking on words,Formal Systems,http://studentnet.cs.manchester.ac.uk/ugt/year3/project/projectbookdetails.php?projectid=55216,Ian Pratt-hartmann,2 students,F,F,No
The Intention Progression Problem,General and domain specific language development,http://studentnet.cs.manchester.ac.uk/ugt/year3/project/projectbookdetails.php?projectid=55147,Louise Dennis,1 student,H,C,Yes
Building knowledge graphs using FAIR Signposting on the Web,Web and web service systems,http://studentnet.cs.manchester.ac.uk/ugt/year3/project/projectbookdetails.php?projectid=55348,Stian Soiland-reyes,2 students,F,F,Yes
CS Computer Clusters ... are there any free PCs?,Web and web service systems,http://studentnet.cs.manchester.ac.uk/ugt/year3/project/projectbookdetails.php?projectid=55213,Paul Nutter,1 student,F,F,No
Dynamic Course Unit Hub: Revolutionising COMP16321 & COMP23111 Learning with Interactive VLEs,Web and web service systems,http://studentnet.cs.manchester.ac.uk/ugt/year3/project/projectbookdetails.php?projectid=55045,Gareth Henshall,2 students,F,F,No
Lab Demo Management System,Web and web service systems,http://studentnet.cs.manchester.ac.uk/ugt/year3/project/projectbookdetails.php?projectid=55199,Paul Nutter,1 student,F,F,No
Maximising information from web publication data,Web and web service systems,http://studentnet.cs.manchester.ac.uk/ugt/year3/project/projectbookdetails.php?projectid=55212,Tom Thomson,1 student,F,F,No
Android Camera App with Sensor Data,Mobile applications and systems,http://studentnet.cs.manchester.ac.uk/ugt/year3/project/projectbookdetails.php?projectid=55292,Terry Morley,2 students,F,F,No
Exploiting Edge Resources in the Execution of Intelligent Transportation System Applications,Information Systems,http://studentnet.cs.manchester.ac.uk/ugt/year3/project/projectbookdetails.php?projectid=55413,Sandra Sampaio,1 student,C,C,Yes